<?xml version="1.0" encoding="UTF-8"?>
<xs:schema xmlns:xs="http://www.w3.org/2001/XMLSchema">

    <xs:element name="factura">
        <xs:complexType>
            <xs:sequence>
                
                <xs:element name="datos_empresa">
                    <xs:complexType>
                        <xs:sequence>
                            <xs:element name="nombre" type="xs:string"/>
                            <xs:element name="direccion" type="xs:string"/>
                            <xs:element name="cif" type="xs:string"/>
                            <xs:element name="telefono" type="xs:string"/>
                            <xs:element name="fax" type="xs:string"/>
                        </xs:sequence>
                    </xs:complexType>
                </xs:element>

                <xs:element name="datos_factura">
                    <xs:complexType>
                        <xs:sequence>
                            <xs:element name="fecha" type="xs:date"/>
                            <xs:element name="pedido" type="xs:integer"/>
                            <xs:element name="forma_pago" type="xs:string"/>
                        </xs:sequence>
                    </xs:complexType>
                </xs:element>

                <xs:element name="datos_cliente">
                    <xs:complexType>
                        <xs:sequence>
                            <xs:element name="nombre" type="xs:string"/>
                            <xs:element name="direccion" type="xs:string"/>
                            <xs:element name="poblacion" type="xs:string"/>
                            <xs:element name="cod_postal" type="xs:integer"/>
                            <xs:element name="provincia" type="xs:string"/>
                        </xs:sequence>
                        <xs:attribute name="n_cliente" type="xs:integer" use="required"/>
                    </xs:complexType>
                </xs:element>

                <xs:element name="detalle_factura">
                    <xs:complexType>
                        <xs:sequence>
                            <xs:element name="linea" maxOccurs="unbounded">
                                <xs:complexType>
                                    <xs:sequence>
                                        <xs:element name="ref" type="xs:string"/>
                                        <xs:element name="descripcion" type="xs:string"/>
                                        <xs:element name="cantidad" type="xs:integer"/>
                                        <xs:element name="precio" type="xs:decimal"/>
                                        <xs:element name="igv" type="xs:decimal"/>
                                        <xs:element name="importe" type="xs:decimal"/>
                                    </xs:sequence>
                                </xs:complexType>
                            </xs:element>
                        </xs:sequence>
                    </xs:complexType>
                </xs:element>

                <xs:element name="totales">
                    <xs:complexType>
                        <xs:sequence>
                            <xs:element name="base_imponible" type="xs:decimal"/>
                            <xs:element name="porcentaje_igv" type="xs:decimal"/>
                            <xs:element name="cuota_igv" type="xs:decimal"/>
                            <xs:element name="total_factura" type="xs:decimal"/>
                        </xs:sequence>
                    </xs:complexType>
                </xs:element>

            </xs:sequence>
            <xs:attribute name="n_factura" type="xs:integer" use="required"/>
        </xs:complexType>
    </xs:element>

</xs:schema>